{
  "bodyTypeName": "male",
  "url": "https://sanderfrenken.github.io/Universal-LPC-Spritesheet-Character-Generator/#?body=Body_color_zombie_green&head=Human_male_zombie_green&arms=Armour_iron&wings=none&tail=Lizard_tail_zombie_green&clothes=Shortsleeve_green&jacket=Trench_coat_gray&legs=Pants_gray&shoes=Shoes_gray&ears=Long_ears_zombie_green",
  "spritesheets": "https://sanderfrenken.github.io/Universal-LPC-Spritesheet-Character-Generator/spritesheets/",
  "version": 1,
  "datetime": "10.06.2023, 10:29:09",
  "credits": "Authors: bluecarrot16, Benjamin K. Smith (BenCreating), Evert, Eliza Wyatt (ElizaWy), TheraHedwig, MuffinElZangano, Durrani, Johannes Sj?lund (wulax), Stephen Challener (Redshrike), Nila122, Michael Whitlock (bigbeargames), Matthew Krohn (makrohn), Johannes Sjölund (wulax), ElizaWy, David Conway Jr. (JaidynReiman), Joe White\n\n- body/bodies/male/universal/zombie_green.png: by bluecarrot16, Benjamin K. Smith (BenCreating), Evert, Eliza Wyatt (ElizaWy), TheraHedwig, MuffinElZangano, Durrani, Johannes Sj?lund (wulax), Stephen Challener (Redshrike). License(s): CC-BY-SA 3.0, GPL 3.0. \n    - https://opengameart.org/content/liberated-pixel-cup-lpc-base-assets-sprites-map-tiles\n    - https://opengameart.org/content/lpc-medieval-fantasy-character-sprites\n    - https://opengameart.org/content/lpc-male-jumping-animation-by-durrani\n    - https://opengameart.org/content/lpc-runcycle-and-diagonal-walkcycle\n    - https://opengameart.org/content/lpc-revised-character-basics\n\n- body/tail/lizard/fg/zombie_green.png: by Nila122, bluecarrot16. License(s): CC-BY-SA 3.0, GPL 3.0. \n    - https://opengameart.org/content/drakes-and-lizardfolk\n\n- body/tail/lizard/bg/zombie_green.png: by Nila122, bluecarrot16. License(s): CC-BY-SA 3.0, GPL 3.0. \n    - https://opengameart.org/content/drakes-and-lizardfolk\n\n- head/heads/human_male/universal/zombie_green.png: by bluecarrot16, Benjamin K. Smith (BenCreating), Stephen Challener (Redshrike). License(s): OGA-BY 3.0, CC-BY-SA 3.0, GPL 3.0. \n    - https://opengameart.org/content/liberated-pixel-cup-lpc-base-assets-sprites-map-tiles\n    - https://opengameart.org/content/lpc-character-bases\n\n- head/ears/long/zombie_green.png: by bluecarrot16, Nila122. License(s): OGA-BY 3.0, GPL 3.0, CC-BY-SA 3.0. \n    - https://opengameart.org/content/lpc-long-ears\n    - http://opengameart.org/content/lpc-clothing-updates\n\n- arms/armour/plate/male/iron.png: by Michael Whitlock (bigbeargames), Matthew Krohn (makrohn), Johannes Sjölund (wulax). License(s): CC-BY-SA 3.0, GPL 3.0. \n    - https://opengameart.org/content/lpc-medieval-fantasy-character-sprites\n    - http://opengameart.org/content/lpc-clothing-updates\n\n- torso/clothes/shortsleeve/male/green.png: by bluecarrot16, ElizaWy, Stephen Challener (Redshrike). License(s): OGA-BY 3.0, CC-BY-SA 3.0, GPL 3.0. \n    - https://opengameart.org/content/liberated-pixel-cup-lpc-base-assets-sprites-map-tiles\n    - http://opengameart.org/content/lpc-revised-character-basics\n    - http://opengameart.org/content/lpc-clothing-updates\n\n- torso/jacket/trench/male/gray.png: by bluecarrot16. License(s): CC-BY-SA 3.0, GPL 3.0. \n    - https://opengameart.org/content/lpc-gentleman\n\n- legs/pants/male/gray.png: by bluecarrot16, David Conway Jr. (JaidynReiman), Joe White, Matthew Krohn (makrohn), Johannes Sjölund (wulax). License(s): CC-BY-SA 3.0, GPL 3.0. \n    - https://opengameart.org/content/liberated-pixel-cup-lpc-base-assets-sprites-map-tiles\n    - https://opengameart.org/content/lpc-medieval-fantasy-character-sprites\n\n- feet/shoes/male/gray.png: by bluecarrot16, Johannes Sjölund (wulax). License(s): CC-BY-SA 3.0, GPL 3.0. \n    - https://opengameart.org/content/lpc-medieval-fantasy-character-sprites\n    - http://opengameart.org/content/lpc-clothing-updates",
  "layers": [
    {
      "fileName": "body/tail/lizard/bg/zombie_green.png",
      "zPos": 5,
      "parentName": "tail",
      "name": "Lizard tail",
      "variant": "zombie_green"
    },
    {
      "fileName": "body/bodies/male/universal/zombie_green.png",
      "zPos": 10,
      "parentName": "body",
      "name": "Body color",
      "variant": "zombie_green"
    },
    {
      "fileName": "feet/shoes/male/gray.png",
      "zPos": 15,
      "parentName": "shoes",
      "name": "Shoes",
      "variant": "gray"
    },
    {
      "fileName": "legs/pants/male/gray.png",
      "zPos": 20,
      "parentName": "legs",
      "name": "Pants",
      "variant": "gray"
    },
    {
      "fileName": "torso/clothes/shortsleeve/male/green.png",
      "zPos": 35,
      "parentName": "clothes",
      "name": "Shortsleeve",
      "variant": "green"
    },
    {
      "fileName": "torso/jacket/trench/male/gray.png",
      "zPos": 55,
      "parentName": "jacket",
      "name": "Trench coat",
      "variant": "gray"
    },
    {
      "fileName": "arms/armour/plate/male/iron.png",
      "zPos": 60,
      "parentName": "arms",
      "name": "Armour",
      "variant": "iron"
    },
    {
      "fileName": "body/tail/lizard/fg/zombie_green.png",
      "zPos": 85,
      "parentName": "tail",
      "name": "Lizard tail",
      "variant": "zombie_green"
    },
    {
      "fileName": "head/heads/human_male/universal/zombie_green.png",
      "zPos": 100,
      "parentName": "head",
      "name": "Human male",
      "variant": "zombie_green"
    },
    {
      "fileName": "head/ears/long/zombie_green.png",
      "zPos": 130,
      "parentName": "ears",
      "name": "Long ears",
      "variant": "zombie_green"
    }
  ]
}